{
  "$schema": "http://json-schema.org/draft-07/schema#",
  "$id": "https://energy-optimizer.local/config.schema.json",
  "title": "Energy Optimizer Konfiguration",
  "description": "JSON-Schema für config.json. In Cursor/VS Code erscheinen Beschreibungen als Hover-Hilfe, wenn \"$schema\" in config.json gesetzt ist.",
  "type": "object",
  "properties": {
    "$schema": {
      "type": "string",
      "description": "Verweis auf diese Schema-Datei für Editor-Hilfen."
    },
    "awattar": {
      "$ref": "#/definitions/awattar",
      "description": "aWATTar-API und Aufschläge für den Bezugsstrompreis (Österreich)."
    },
    "system": {
      "$ref": "#/definitions/system",
      "description": "HTTP-Timeouts und Intervall der Optimierungs-Schleife (main.py)."
    },
    "runtime_settings": {
      "$ref": "#/definitions/runtime_settings",
      "description": "Laufzeitparameter für PV, Batterie und Optimierung."
    },
    "scenarios": {
      "type": "array",
      "description": "Alternative Parameter-Sets nur für Simulation und Backtesting (nicht Produktiv).",
      "items": {
        "$ref": "#/definitions/scenario"
      }
    },
    "file_paths_battery_simulation": {
      "$ref": "#/definitions/file_paths_battery_simulation",
      "description": "Pfade zu historischen CSVs, cons_data und Preisquelle."
    },
    "loxone_blocks": {
      "$ref": "#/definitions/loxone_blocks",
      "description": "Merker- und Virtuelle-Eingang-Namen des Loxone Miniservers (Lesen/Schreiben)."
    },
    "flexible_consumers": {
      "type": "array",
      "description": "Steuerbare Verbraucher für die MILP-Optimierung.",
      "items": {
        "$ref": "#/definitions/flexible_consumer"
      }
    }
  },
  "definitions": {
    "awattar": {
      "type": "object",
      "description": "Bezugspreis aus aWATTar-Marktdaten mit Netzaufschlägen.",
      "properties": {
        "url": {
          "type": "string",
          "description": "API-URL für Stundenmarktpreise (Standard: api.awattar.at)."
        },
        "fix_aufschlag_cent": {
          "type": "number",
          "description": "Fixer Aufschlag in Cent/kWh (Netz, Gebühren) auf den Börsenpreis."
        },
        "netzverlust_faktor": {
          "type": "number",
          "exclusiveMinimum": 0,
          "description": "Multiplikator für Netzverluste auf den Marktpreis (z. B. 1.03)."
        },
        "mwst_austria_faktor": {
          "type": "number",
          "exclusiveMinimum": 0,
          "description": "USt-Faktor auf den Bezugspreis (z. B. 1.2 für 20 %)."
        }
      }
    },
    "system": {
      "type": "object",
      "description": "System-Timeouts für Loxone-HTTP und main.py-Schleife.",
      "properties": {
        "global_timeout": {
          "type": "integer",
          "exclusiveMinimum": 0,
          "description": "HTTP-Timeout in Sekunden für Loxone- und API-Anfragen."
        },
        "loop_timeout": {
          "type": "integer",
          "exclusiveMinimum": 0,
          "description": "Maximale Wartezeit zwischen Optimierungs-Durchläufen in Sekunden (900 = 15 Min.)."
        },
        "loxone_silent_mode": {
          "type": "boolean",
          "description": "main.py: true = Optimierung läuft, aber keine Steuerwerte an Loxone senden (parallele Produktiv-Session schützen)."
        },
        "event_trigger_enabled": {
          "type": "boolean",
          "description": "main.py: true = außerplanmäßige Optimierung bei Ereignissen (z. B. E-Auto An-/Abstecken) vor der nächsten Viertelstunde."
        },
        "charging_poll_interval_sec": {
          "type": "integer",
          "minimum": 1,
          "description": "Abfrageintervall in Sekunden für plugged_in_name zwischen regulären Optimierungsläufen."
        }
      }
    },
    "runtime_settings": {
      "type": "object",
      "description": "Laufzeitparameter (Echtzeit-Optimierung). Siehe auch docs/konfiguration/batterie-pv.md.",
      "properties": {
        "k_push_cent": {
          "type": "number",
          "description": "Einspeisevergütung in Cent/kWh (Erlös bei Netzeinspeisung)."
        },
        "pv_tilt": {
          "type": "number",
          "description": "PV-Dachneigung in Grad."
        },
        "pv_azimuth": {
          "type": "number",
          "description": "PV-Ausrichtung in Grad: 0=Süd, -90=Ost, 90=West."
        },
        "pv_kwp": {
          "type": "number",
          "exclusiveMinimum": 0,
          "description": "Installierte PV-Leistung in kWp."
        },
        "latitude": {
          "type": "number",
          "description": "Standort-Breitengrad für PV-Prognose (Forecast.Solar)."
        },
        "longitude": {
          "type": "number",
          "description": "Standort-Längengrad für PV-Prognose."
        },
        "battery_max_power_kw": {
          "type": "number",
          "exclusiveMinimum": 0,
          "description": "Maximale Lade- und Entladeleistung des Speichers in kW."
        },
        "battery_efficiency": {
          "type": "number",
          "exclusiveMinimum": 0,
          "maximum": 1,
          "description": "Roundtrip-Wirkungsgrad Batterie (Laden/Entladen)."
        },
        "battery_capacity_kwh": {
          "type": "number",
          "exclusiveMinimum": 0,
          "description": "Nutzbare Speicherkapazität in kWh."
        },
        "battery_min_soc": {
          "type": "number",
          "minimum": 0,
          "maximum": 100,
          "description": "Untere SOC-Grenze in % (Schutz)."
        },
        "battery_force_discharge_min_soc": {
          "type": "number",
          "minimum": 0,
          "maximum": 100,
          "description": "Ab diesem SOC in % darf Zwangsentladung zur Kostensenkung genutzt werden."
        },
        "battery_max_soc": {
          "type": "number",
          "minimum": 0,
          "maximum": 100,
          "description": "Obere SOC-Grenze in %."
        },
        "threshold_power": {
          "type": "number",
          "exclusiveMinimum": 0,
          "maximum": 1,
          "description": "Relative Leistungsschwelle als Anteil von battery_max_power_kw (z. B. 0.02 = 2 %). Gilt für Modus-Erkennung und Zwangsentladen vs. Automatik."
        },
        "battery_end_soc_equals_start": {
          "type": "boolean",
          "description": "MILP-Randbedingung: SOC am Ende des Planungshorizonts entspricht dem SOC zu Beginn der Simulation bzw. (Live) dem aktuellen SOC. Verhindert künstliches Entladen am Horizontende."
        }
      }
    },
    "scenario": {
      "type": "object",
      "description": "Benanntes Szenario für Simulation/Backtesting.",
      "required": ["id", "label", "settings"],
      "properties": {
        "id": {
          "type": "string",
          "description": "Eindeutige Szenario-Kennung (z. B. battery_10kwh)."
        },
        "label": {
          "type": "string",
          "description": "Anzeigename in der UI."
        },
        "settings": {
          "$ref": "#/definitions/runtime_settings",
          "description": "Parameter-Override (gleiche Felder wie runtime_settings)."
        }
      }
    },
    "file_paths_battery_simulation": {
      "type": "object",
      "description": "Dateipfade und Preisquelle für Historie, cons_data und Backtesting.",
      "properties": {
        "path_consumption": {
          "type": "string",
          "description": "CSV mit historischem Gesamtverbrauch (Loxone-Export)."
        },
        "path_production": {
          "type": "string",
          "description": "CSV mit historischer PV-Produktion (Loxone-Export)."
        },
        "path_price": {
          "type": "string",
          "description": "CSV mit historischen Börsenstrompreisen (Energy-Charts o. ä.)."
        },
        "path_cons_data": {
          "type": "string",
          "description": "Stündliche Verbrauchs-/PV-Basisdatei (von main.py gepflegt)."
        },
        "cons_data_retention_months": {
          "type": "integer",
          "exclusiveMinimum": 0,
          "description": "Aufbewahrungsdauer für cons_data in Monaten."
        },
        "cons_data_write_mode": {
          "type": "string",
          "enum": ["hourly"],
          "description": "Schreibmodus für cons_data (derzeit nur hourly)."
        },
        "price_source": {
          "type": "string",
          "description": "api = Live-Preise; andere Werte für historische Preise aus path_price."
        },
        "price_provider": {
          "type": "string",
          "description": "Preisanbieter für Live-API (z. B. awattar)."
        },
        "price_range": {
          "type": "string",
          "description": "Zeitraum für historische Preise (z. B. last_12_months)."
        },
        "energy_charts_bzn": {
          "type": "string",
          "description": "Bidding Zone für Energy-Charts-CSV (z. B. DE-LU)."
        }
      }
    },
    "loxone_blocks": {
      "type": "object",
      "description": "Zentrale Loxone-IO-Namen für Speicher, PV und Steuerbefehle.",
      "required": [
        "soc_name",
        "pv_counter_name",
        "log_filename",
        "pv_tuning_log_file",
        "pv_power_name",
        "battery_power_name",
        "grid_power_name",
        "target_soc_name",
        "target_charge_power_name",
        "target_discharge_power_name",
        "control_cmd_name"
      ],
      "properties": {
        "soc_name": {
          "type": "string",
          "description": "Aktueller Batterie-SOC in % (Lesen)."
        },
        "pv_counter_name": {
          "type": "string",
          "description": "PV-Zählerstand kumuliert in kWh (Lesen, PV-Tuning)."
        },
        "log_filename": {
          "type": "string",
          "description": "FTP-Logdateiname auf dem Miniserver."
        },
        "pv_tuning_log_file": {
          "type": "string",
          "description": "Lokale CSV für adaptives PV-Tuning (Prognose vs. Ist). Schreiben derzeit in main.py nicht angebunden."
        },
        "pv_power_name": {
          "type": "string",
          "description": "Aktuelle PV-Leistung in kW (Lesen)."
        },
        "battery_power_name": {
          "type": "string",
          "description": "Aktuelle Batterieleistung in kW (Lesen, Vorzeichen: + laden, − entladen)."
        },
        "grid_power_name": {
          "type": "string",
          "description": "Aktuelle Netzleistung in kW (Lesen)."
        },
        "target_soc_name": {
          "type": "string",
          "description": "Virtueller Eingang: Ziel-SOC in % (Schreiben)."
        },
        "target_charge_power_name": {
          "type": "string",
          "description": "Virtueller Eingang: Zwangsladeleistung in kW (Schreiben)."
        },
        "target_discharge_power_name": {
          "type": "string",
          "description": "Virtueller Eingang: Ziel-Entladeleistung in kW (Schreiben)."
        },
        "control_cmd_name": {
          "type": "string",
          "description": "Virtueller Eingang: Huawei-Steuerbefehl (Register 47100): 0=Automatik, 1=Zwangsladen/Entladesperre, 2=Zwangs-Entladen."
        }
      }
    },
    "loxone_outputs": {
      "type": "object",
      "description": "Steuer-Signale an den Loxone Miniserver. Entweder binäre Freigabe oder kW-Sollwert (nicht beides).",
      "properties": {
        "enable_name": {
          "type": "string",
          "description": "Virtueller Eingang: 0 = gesperrt, 1 = Freigabe (Volllast über nominal_power_kw)."
        },
        "power_setpoint_name": {
          "type": "string",
          "description": "Virtueller Eingang: Soll-Ladeleistung in kW (0 = aus; bei pv_follow=1 als P_max-Deckel)."
        },
        "pv_follow_name": {
          "type": "string",
          "description": "Virtueller Eingang: 0 = feste Leistung laut power_setpoint_name; 1 = PV-Überschuss bis P_max."
        }
      }
    },
    "flexible_consumer": {
      "type": "object",
      "required": ["id", "name", "nominal_power_kw"],
      "properties": {
        "id": {
          "type": "string",
          "description": "Eindeutige interne Kennung (z. B. eauto, swimspa)."
        },
        "name": {
          "type": "string",
          "description": "Anzeigename in der UI."
        },
        "nominal_power_kw": {
          "type": "number",
          "description": "Maximale Leistung in kW für die Optimierung (P_max; live überschreibbar via charging_schedule.loxone.nominal_power_kw_name)."
        },
        "min_power_kw": {
          "type": "number",
          "minimum": 0,
          "description": "Minimale Soll-Leistung in kW (P_min), Pflicht wenn loxone_outputs.power_setpoint_name gesetzt ist."
        },
        "daily_target_kwh": {
          "type": "number",
          "description": "Festes 24h-Ziel in kWh. Für Verbraucher ohne charging_schedule, wenn daily_target_source=config."
        },
        "daily_target_source": {
          "type": "string",
          "enum": ["config", "historical", "loxone"],
          "description": "Quelle des 24h-Ziels (kWh): config = daily_target_kwh bzw. bei charging_schedule daily_rest_soc; historical = in Echtzeit Summe aus flexible_consumer_profiles.csv über den 24h-Horizont (wie Baseline), bei historischer Tages-Simulation geloggte CSV-Summen; loxone = Live-Merker (bei E-Auto: charging_schedule.loxone)."
        },
        "loxone_target_kwh_name": {
          "type": "string",
          "description": "Loxone-Merkername für kWh-Ziel (nur bei daily_target_source=loxone ohne charging_schedule)."
        },
        "min_on_quarterhours": {
          "type": "integer",
          "minimum": 1,
          "description": "Mindestlaufzeit pro Einschaltung in 15-Minuten-Slots."
        },
        "path_log": {
          "type": "string",
          "description": "CSV-Pfad zum Loxone-Verbrauchslog (für historical und Backtesting)."
        },
        "signal_type": {
          "type": "string",
          "enum": ["power", "binary"],
          "description": "power = Leistungsprofil in kW; binary = Ein/Aus-Signal (Live und Logs, sofern log_signal_type nicht gesetzt)."
        },
        "log_signal_type": {
          "type": "string",
          "enum": ["power", "binary"],
          "description": "Optional: Interpretation von path_log (z. B. binary für altes Loxone-Log, während signal_type=power für Live-Messung)."
        },
        "optimizer_enabled": {
          "type": "boolean",
          "description": "false = Verbraucher von der Optimierung ausschließen."
        },
        "loxone_outputs": {
          "$ref": "#/definitions/loxone_outputs",
          "description": "Freigabe-Merker für die aktive Ansteuerung durch die Optimierung."
        },
        "loxone_inputs": {
          "type": "object",
          "description": "Live-Messwerte aus Loxone für cons_data_hourly (main.py).",
          "properties": {
            "power_name": {
              "type": "string",
              "description": "Merkername: bei signal_type=power (oder loxone_inputs.signal_type=power) kW-Leistung; bei binary Ein/Aus (0/1), wird mit nominal_power_kw multipliziert."
            },
            "signal_type": {
              "type": "string",
              "enum": ["power", "binary"],
              "description": "Optional: überschreibt signal_type nur für die Live-Abfrage in main.py."
            }
          }
        },
        "charging_schedule": {
          "$ref": "#/definitions/charging_schedule"
        }
      }
    },
    "charging_schedule": {
      "type": "object",
      "description": "Ladezeitfenster und Zielenergie für das E-Auto (oder andere zeitgebundene Lader).",
      "required": ["enabled"],
      "properties": {
        "enabled": {
          "type": "boolean",
          "description": "true = Ladeplanung mit Zeitfenster aktiv."
        },
        "forecast_when_absent": {
          "type": "boolean",
          "description": "Nur bei daily_target_source=loxone: true = bei Abwesenheit (plugged_in≠1) Ladeplanung aus charging_schedule prognostizieren (car_available_from_hour, ready_by_hour, daily_rest_soc). false = E-Auto inaktiv bis Anschluss."
        },
        "battery_capacity_kwh": {
          "type": "number",
          "description": "Fahrzeug-Akkukapazität in kWh (für SOC→kWh bei daily_target_source=config oder loxone)."
        },
        "target_soc_percent": {
          "type": "number",
          "description": "Ziel-SOC in % beim Abfahren (Standard 100)."
        },
        "charging_efficiency": {
          "type": "number",
          "minimum": 0,
          "maximum": 1,
          "description": "Angenommener Lade-Wirkungsgrad (Netz-/Zählerenergie → Akku), Standard 0,95. Ladeziel kWh = (target_soc_percent − Rest-SOC) / 100 × battery_capacity_kwh / charging_efficiency."
        },
        "weekday": {
          "$ref": "#/definitions/charging_day_schedule",
          "description": "Montag–Freitag."
        },
        "weekend": {
          "$ref": "#/definitions/charging_day_schedule",
          "description": "Samstag–Sonntag."
        },
        "loxone": {
          "type": "object",
          "description": "Loxone-Merker für E-Auto-Status (Lesen) und optional Steuerung (Schreiben).",
          "properties": {
            "plugged_in_name": {
              "type": "string",
              "description": "1 = Fahrzeug angeschlossen. Bei forecast_when_absent=false: sonst keine Ladeplanung."
            },
            "ready_by_time_name": {
              "type": "string",
              "description": "Fertig-Ladezeitpunkt (z. B. 'Morgen, 06:00')."
            },
            "soc_at_plug_in_name": {
              "type": "string",
              "description": "SOC in % beim Anschließen → Restenergiebedarf in kWh."
            },
            "nominal_power_kw_name": {
              "type": "string",
              "description": "Max. Ladeleistung in kW (live gelesen für die Optimierung; Fallback: nominal_power_kw in config)."
            },
            "charge_enable_name": {
              "type": "string",
              "description": "Alternative zu loxone_outputs.enable_name (Legacy, nur E-Auto)."
            }
          }
        }
      }
    },
    "charging_day_schedule": {
      "type": "object",
      "description": "Ladezeitfenster und Restladung für einen Tagtyp.",
      "properties": {
        "car_available_from_hour": {
          "type": "integer",
          "minimum": 0,
          "maximum": 23,
          "description": "Früheste Stunde (0–23), ab der geladen werden darf."
        },
        "ready_by_hour": {
          "type": "integer",
          "minimum": 0,
          "maximum": 23,
          "description": "Späteste Stunde (exklusiv) bzw. Abfahrtszeit; Laden muss bis dahin abgeschlossen sein (früher fertig ist erlaubt)."
        },
        "daily_rest_soc": {
          "type": "number",
          "description": "Rest-SOC in % beim Anschließen (nur daily_target_source=config). Unterschiedlich für weekday und weekend möglich."
        }
      }
    }
  }
}
