{
    "$schema": "./config.schema.json",
    "awattar": {
        "url": "https://api.awattar.at/v1/marketdata",
        "fix_aufschlag_cent": 1.5,
        "netzverlust_faktor": 1.03,
        "mwst_austria_faktor": 1.20
    },
    "system": {
        "global_timeout": 10,
        "loop_timeout": 900
    },
    "loxone_blocks": {
        "soc_name": "B004-Battery_SOC",
        "pv_counter_name": "48 - Accumulated energy yield",
        "log_filename": "Verbrauch.csv",
        "pv_tuning_log_file": "pv_accuracy_log.csv",
        "pv_power_name": "Ernie-Merker-PV_Act",
        "battery_power_name": "Ernie-Merker-LeistungBat_Act",
        "grid_power_name": "Ernie-Merker-LeistungNetz_Act",
        "target_soc_name": "Ernie_Ziel_SoC",
        "target_charge_power_name": "Ernie_Ziel_LadeLeistung",
        "target_discharge_power_name": "Ernie_Ziel_Entladeleistung",
        "control_cmd_name": "Ernie_Steuerbefehl"
    },
    "runtime_settings": {
        "k_push_cent": 3.7,
        "pv_tilt": 25,
        "pv_azimuth": 0,
        "pv_kwp": 10,
        "battery_max_power_kw": 2.5,
        "battery_efficiency": 0.97,
        "battery_capacity_kwh": 5.0,
        "battery_min_soc": 10.0,
        "battery_max_soc": 100.0,
        "threshold_power": 0.02,
        "latitude": 48,
        "longitude": 10
    },
    "flexible_consumers": [
        {
            "id": "swimspa",
            "name": "SwimSpa",
            "nominal_power_kw": 2.8,
            "daily_target_kwh": 5.0,
            "daily_target_source": "historical",
            "min_on_quarterhours": 8,
            "path_log": "pfad/zum/swimspa-log.csv",
            "signal_type": "power",
            "optimizer_enabled": true,
            "loxone_outputs": {
                "enable_name": "Ernie_SwimSpa_Freigabe"
            },
            "loxone_inputs": {
                "power_name": "Merkername SwimSpa kW"
            }
        },
        {
            "id": "eauto",
            "name": "E-Auto",
            "nominal_power_kw": 3.5,
            "daily_target_source": "config",
            "min_on_quarterhours": 4,
            "path_log": "pfad/zum/eauto-log.csv",
            "signal_type": "power",
            "optimizer_enabled": true,
            "loxone_outputs": {
                "enable_name": "Ernie_EAuto_LadeFreigabe"
            },
            "loxone_inputs": {
                "power_name": "Merkername EAuto kW"
            },
            "charging_schedule": {
                "enabled": true,
                "forecast_when_absent": true,
                "battery_capacity_kwh": 77.0,
                "target_soc_percent": 100.0,
                "charging_efficiency": 0.95,
                "weekday": {
                    "car_available_from_hour": 18,
                    "ready_by_hour": 7,
                    "daily_rest_soc": 40.0
                },
                "weekend": {
                    "car_available_from_hour": 20,
                    "ready_by_hour": 9,
                    "daily_rest_soc": 30.0
                },
                "loxone": {
                    "plugged_in_name": "EAuto_Angeschlossen",
                    "ready_by_time_name": "EAuto_FertigUm",
                    "soc_at_plug_in_name": "EAuto_SOC_bei_Anschluss",
                    "nominal_power_kw_name": "EAuto_MaxLeistung"
                }
            }
        }
    ]
}
